{
  "id": "ECO-INF-K8S-002",
  "name": "Missing HPA for horizontally scalable workloads",
  "summary": "Workloads that can scale horizontally but do not use autoscaling can waste cluster capacity or under-serve demand.",
  "description": "When a workload is horizontally scalable, the absence of an HPA or equivalent scaling policy can lead to static overprovisioning or inefficient manual scaling.",
  "category_code": "INF",
  "family_code": "K8S",
  "layer": "process",
  "ontology": {
    "category": "Infrastructure",
    "family": "Kubernetes",
    "system_layers": [
      "process",
      "architecture"
    ]
  },
  "impact": {
    "cost": "Static replicas often overrun actual need.",
    "performance": "Manual scaling lags real demand.",
    "carbon": "Idle replicas consume resources without corresponding value."
  },
  "detection": {
    "method": "yaml-k8s",
    "selector": "missing_hpa_for_scalable_workload"
  },
  "remediation": {
    "guidance": "Use autoscaling where workloads and metrics support it, and tune target thresholds carefully.",
    "examples": [
      "Deploy HPA for stateless services with clear CPU or custom metric signals."
    ]
  },
  "metadata": {
    "status": "draft",
    "severity": "medium",
    "version": "0.3.0-draft",
    "catalog_version": "0.4.0"
  },
  "scanner_override": {
    "scope": "repo",
    "manifest_kinds": [
      "Deployment",
      "StatefulSet"
    ]
  }
}